<?xml version="1.0" encoding="UTF-8"?>
<!DOCTYPE weather-report[
<!ELEMENT weather-report (weather)+>
<!ELEMENT weather (Day+,Date+,Place+,type+,Report+)>
<!ELEMENT Day (#PCDATA)>
<!ELEMENT Date (#PCDATA)>
<!ELEMENT Place ANY>
<!ELEMENT Report (#PCDATA)>
]>
<weather-report>

<weather>
<Day>Monday</Day>
<Date>02-08-2001</Date>
<Place>Vijayawada</Place>
<type>Sunny</type>
<Report>35</Report>
</weather>

<weather>
<Day>Tuesday</Day>
<Date>03-08-2001</Date>
<Place>Hyderabad</Place>
<type>Sunny</type>
<Report>36</Report>
</weather>

<weather>
<Day>Wednesday</Day>
<Date>04-08-2001</Date>
<Place>Mumbai</Place>
<type>Sunny</type>
<Report>32</Report>
</weather>

<weather>
<Day>Thursday</Day>
<Date>05-08-2001</Date>
<Place>Gujarat</Place>
<type>Sunny</type>
<Report>35</Report>
</weather>

<weather>
<Day>Friday</Day>
<Date>06-08-2001</Date>
<Place>Delhi</Place>
<type>Cloudy</type>
<Report>23</Report>
</weather>

<weather>
<Day>Saturday</Day>
<Date>07-08-2001</Date>
<Place>Kerala</Place>
<type>Cloudy</type>
<Report>25</Report>
</weather>

</weather-report>